"名前","値","許可された値","変更可能","送信元","適用タイプ","データ型","説明","ApplyMethod","MinimumEngineVersion"
"sort_buffer_size",,"32768-18446744073709551615",true,"engine-default","dynamic","integer","Larger value improves perf for ORDER BY or GROUP BY operations.","pending-reboot",
"source_verify_checksum",,"0,1",true,"engine-default","dynamic","boolean","Enabling this variable causes the source to examine checksums when reading from the binary log.","pending-reboot",
"sql_mode","0","0,ANSI,ALLOW_INVALID_DATES,ANSI_QUOTES,ERROR_FOR_DIVISION_BY_ZERO,HIGH_NOT_PRECEDENCE,IGNORE_SPACE,NO_AUTO_VALUE_ON_ZERO,NO_BACKSLASH_ESCAPES,NO_DIR_IN_CREATE,NO_ENGINE_SUBSTITUTION,NO_UNSIGNED_SUBTRACTION,NO_ZERO_DATE,NO_ZERO_IN_DATE,ONLY_FULL_GROUP_BY,PAD_CHAR_TO_FULL_LENGTH,PIPES_AS_CONCAT,REAL_AS_FLOAT,STRICT_ALL_TABLES,STRICT_TRANS_TABLES,TRADITIONAL,TIME_TRUNCATE_FRACTIONAL",true,"system","dynamic","list","Current SQL Server Mode.","pending-reboot",
"sql_select_limit",,"0-18446744073709551615",true,"engine-default","dynamic","integer","The maximum number of rows to return from SELECT statements.","pending-reboot",
"stored_program_cache",,"256-524288",true,"engine-default","dynamic","integer","Sets a soft upper limit for the number of cached stored routines per connection.","pending-reboot",
"stored_program_definition_cache",,"256-524288",true,"engine-default","dynamic","integer","Defines a limit for the number of stored program definition objects, both used and unused, that can be kept in the dictionary object cache.","pending-reboot",
"sync_binlog","1","0-18446744073709547520",false,"system","dynamic","integer","Sync binlog (MySQL flush to disk or rely on OS)","pending-reboot",
"sync_relay_log_info",,"0-18446744073709547520",true,"engine-default","dynamic","integer","The number of transactions after which the replica updates the applier metadata repository. A zero value means that the file contents are only flushed by the operating system.","pending-reboot",
"sync_source_info",,"0-18446744073709547520",true,"engine-default","dynamic","integer","sync_source_info specifies the number of events after which the replica updates the connection metadata repository","pending-reboot",
"sysdate-is-now",,"0,1",true,"engine-default","static","boolean","Causes SYSYDATE() to be an alias for NOW(). Replication related","pending-reboot",
"table_cache_element_entry_ttl",,"5",false,"engine-default","static","integer","table_cache_element_entry_ttl","pending-reboot",
"table_definition_cache","LEAST({DBInstanceClassMemory/393040}, 20000)","-1,400-524288",true,"engine-default","dynamic","integer","The number of table definitions that can be stored in the definition cache","pending-reboot",
"table_open_cache","LEAST({DBInstanceClassMemory/1179121}, 6000)","1-524288",true,"engine-default","dynamic","integer","The number of open tables for all threads. Increasing this value increases the number of file descriptors.","pending-reboot",
"table_open_cache_instances",,"1-64",true,"engine-default","static","integer","The number of open tables cache instances.","pending-reboot",
"tablespace_definition_cache",,"256-524288",true,"engine-default","dynamic","integer","Defines a limit for the number of tablespace definition objects, both used and unused, that can be kept in the dictionary object cache.","pending-reboot",
"temptable_max_mmap","1073741824","0-18446744073709551615",true,"engine-default","dynamic","integer","Defines the maximum amount of memory (in bytes) the TempTable storage engine is permitted to allocate from memory-mapped temporary files before it starts storing data to InnoDB internal temporary tables on disk. A setting of 0 disables allocation of memory from memory-mapped temporary files.","pending-reboot",
"temptable_max_ram","1073741824","2097152-18446744073709551615",true,"engine-default","dynamic","integer","Defines the maximum amount of memory that can be occupied by the TempTable storage engine before it starts storing data on disk.","pending-reboot",
"temptable_use_mmap","1","0,1",true,"engine-default","dynamic","boolean","Defines whether the TempTable storage engine allocates space for internal in-memory temporary tables as memory-mapped temporary files when the amount of memory occupied by the TempTable storage engine exceeds the limit defined by the temptable_max_ram variable. When temptable_use_mmap is disabled, the TempTable storage engine uses InnoDB on-disk internal temporary tables instead. Deprecated in MySQL Community 8.0.26","pending-reboot",
"thread_cache_size","{DBInstanceClassMemory/1005785088}","0-16384",true,"system","dynamic","integer","Number of threads to be cached. Doesn't improve perf for good thread implementations.","pending-reboot",
"thread_handling","thread-pools","thread-pools,no-threads,one-thread-per-connection,dynamically-loaded",false,"system","static","string","The thread-handling model used by the server for connection threads.","pending-reboot",
"thread_stack","262144","131072-18446744073709547520",true,"engine-default","static","integer","If the thread stack size is too small, it limits the complexity of the SQL statements that the server can handle, the recursion depth of stored procedures, and other memory-consuming actions.","pending-reboot",
"time_zone",,"Africa/Harare,Africa/Monrovia,Africa/Nairobi,Africa/Windhoek,America/Bogota,America/Caracas,America/Chihuahua,America/Cuiaba,America/Denver,America/Fortaleza,America/Guatemala,America/Halifax,America/Manaus,America/Matamoros,America/Monterrey,America/Montevideo,America/Phoenix,America/Tijuana,Asia/Ashgabat,Asia/Baghdad,Asia/Baku,Asia/Bangkok,Asia/Beirut,Asia/Calcutta,Asia/Kabul,Asia/Karachi,Asia/Kathmandu,Asia/Muscat,Asia/Riyadh,Asia/Seoul,Asia/Shanghai,Asia/Singapore,Asia/Taipei,Asia/Tehran,Asia/Tokyo,Asia/Ulaanbaatar,Atlantic/Azores,Australia/Adelaide,Australia/Brisbane,Australia/Darwin,Australia/Hobart,Australia/Perth,Australia/Sydney,Canada/Saskatchewan,Brazil/East,Europe/Amsterdam,Europe/Athens,Europe/Dublin,Europe/Helsinki,Europe/Paris,Europe/Prague,Europe/Sarajevo,Pacific/Auckland,Pacific/Guam,Pacific/Honolulu,Pacific/Samoa,US/Alaska,US/Central,US/Eastern,US/East-Indiana,US/Pacific,UTC",true,"engine-default","dynamic","string","for changing time zone of db server locally","pending-reboot",
"tls_version",,"TLSv1,TLSv1.1,TLSv1.2",true,"engine-default","static","list","The protocols permitted by the server for encrypted connections.","pending-reboot",
"tmpdir","/rdsdbdata/tmp/",,false,"system","static","string","The directory used for temporary files and temporary tables","pending-reboot",
"tmp_table_size",,"1024-18446744073709551615",true,"engine-default","dynamic","integer","If an in-memory temporary table exceeds the limit, MySQL automatically converts it to an on-disk MyISAM table. Increased value can improve perf for many advanced GROUP BY queries.","pending-reboot",
"transaction_alloc_block_size",,"1024-18446744073709547520",true,"engine-default","dynamic","integer","The amount in bytes by which to increase a per-transaction memory pool which needs memory.","pending-reboot",
"transaction_isolation",,"READ-UNCOMMITTED,READ-COMMITTED,REPEATABLE-READ,SERIALIZABLE",true,"engine-default","dynamic","string","Sets the default isolation level.","pending-reboot",
"transaction_prealloc_size",,"1024-18446744073709547520",true,"engine-default","dynamic","integer","There is a per-transaction memory pool from which various transaction-related allocations take memory. For every allocation that cannot be satisfied from the pool because it has insufficient memory available, the pool is incremented.","pending-reboot",
"updatable_views_with_limit",,"0,1",true,"engine-default","dynamic","boolean","This variable controls whether updates to a view can be made when the view does not contain all columns of the primary key defined in the underlying table, if the update statement contains a LIMIT clause (Often generated by GUI tools).","pending-reboot",
"validate-password",,"ON,OFF,FORCE,FORCE_PLUS_PERMANENT",false,"engine-default","static","string","This option controls how the server loads the validate_password plugin at startup.","pending-reboot",
"validate_password_dictionary_file",,,false,"engine-default","static","string","The path name of the dictionary file used by the validate_password plugin for checking passwords.","pending-reboot",
"validate_password_length",,"0-2147483647",false,"engine-default","dynamic","integer","The path name of the dictionary file used by the validate_password plugin for checking passwords.","pending-reboot",
"validate_password_mixed_case_count",,"0-2147483647",false,"engine-default","dynamic","integer","The minimum number of lowercase and uppercase characters that passwords checked by the validate_password plugin must have if the password policy is MEDIUM or stronger.","pending-reboot",
"validate_password_number_count",,"0-2147483647",false,"engine-default","dynamic","integer","The minimum number of numeric (digit) characters that passwords checked by the validate_password plugin must have if the password policy is MEDIUM or stronger.","pending-reboot",
"validate_password_policy",,"LOW,MEDIUM,STRONG",false,"engine-default","dynamic","string","The password policy enforced by the validate_password plugin.","pending-reboot",
"validate_password_special_char_count",,"0-2147483647",false,"engine-default","dynamic","integer","The minimum number of nonalphanumeric characters that passwords checked by the validate_password plugin must have if the password policy is MEDIUM or stronger.","pending-reboot",
"wait_timeout",,"1-31536000",true,"engine-default","dynamic","integer","The number of seconds the server waits for activity on a non-interactive TCP/IP or UNIX File connection before closing it.","pending-reboot",
"windowing_use_high_precision",,"0,1",true,"engine-default","dynamic","boolean","For SQL window functions, determines whether to enable inversion optimization for moving window frames also for floating values.","pending-reboot",