"名前","値","許可された値","変更可能","送信元","適用タイプ","データ型","説明","ApplyMethod","MinimumEngineVersion"
"activate_all_roles_on_login","0","0,1",true,"engine-default","dynamic","boolean","Automatically set all granted roles as active after the user has authenticated successfully.","pending-reboot",
"allow-suspicious-udfs",,"0,1",false,"engine-default","static","boolean","Controls whether user-defined functions that have only an xxx symbol for the main function can be loaded","pending-reboot",
"aurora_binlog_replication_max_yield_seconds",,"0-36000",true,"engine-default","dynamic","integer","Controls the number of seconds that binary log dump thread waits up to for the current binlog file to be filled by transactions. This wait period avoids contention that can arise from replicating each binlog event individually.","pending-reboot",
"aurora_enable_staggered_replica_restart",,"0,1",true,"system","dynamic","boolean","Allow Aurora replicas to follow a staggered restart schedule to increase cluster availability.","pending-reboot",
"aurora_fwd_writer_idle_timeout","60","1-86400",true,"system","dynamic","integer","The number of seconds the server waits for activity on a forwarded Replica connection before closing it.","pending-reboot",
"aurora_fwd_writer_max_connections_pct","10","0-90",true,"system","dynamic","integer","The percentage of max_connections that can be used for connections forwarded from Replicas.","pending-reboot",
"aurora_parallel_query",,"0,1",true,"engine-default","dynamic","boolean","This parameter can be used to enable and disable Aurora Parallel Query.","pending-reboot",
"autocommit",,"0,1",true,"engine-default","dynamic","boolean","Sets the autocommit mode","pending-reboot",
"auto_increment_increment",,"1-65535",true,"engine-default","dynamic","integer","Intended for use with source-to-source replication, and can be used to control the operation of AUTO_INCREMENT columns","pending-reboot",
"auto_increment_offset",,"1-65535",true,"engine-default","dynamic","integer","Determines the starting point for the AUTO_INCREMENT column value","pending-reboot",
"automatic_sp_privileges",,"0,1",true,"engine-default","dynamic","boolean","When this variable has a value of 1 (the default), the server automatically grants the EXECUTE and ALTER ROUTINE privileges to the creator of a stored routine, if the user cannot already execute and alter or drop the routine.","pending-reboot",
"aws_default_comprehend_role",,,true,"engine-default","dynamic","string","Default IAM role ARN used for integration with AWS Comprehend","pending-reboot",
"aws_default_lambda_role",,,true,"engine-default","dynamic","string","aws_default_lambda_role","pending-reboot",
"aws_default_logs_role",,,true,"engine-default","dynamic","string","Arn for the role used to upload data to CloudWatch Logs","pending-reboot",
"aws_default_s3_role",,,true,"engine-default","dynamic","string","aws_default_s3_role","pending-reboot",
"aws_default_sagemaker_role",,,true,"engine-default","dynamic","string","Default IAM role ARN used for integration with AWS SageMaker","pending-reboot",
"back_log",,"1-65535",true,"engine-default","static","integer","The number of outstanding connection requests MySQL can have","pending-reboot",
"basedir","/rdsdbbin/oscar",,false,"system","static","string","The MySQL installation base directory.","pending-reboot",
"binlog_cache_size","32768","4096-18446744073709547520",true,"system","dynamic","integer","The size of the cache to hold the SQL statements for the binary log during a transaction.","pending-reboot",
"binlog_checksum",,"NONE,CRC32",true,"engine-default","dynamic","string","When enabled, this variable causes the source to write a checksum for each event in the binary log.","pending-reboot",
"binlog-do-db",,,true,"engine-default","static","list","Creates a replication filter using the name of a database","pending-reboot",
"binlog_error_action",,"IGNORE_ERROR,ABORT_SERVER",true,"engine-default","dynamic","string","Controls what happens when the server cannot write to the binary log.","pending-reboot",
"binlog_format","OFF","ROW,STATEMENT,MIXED,OFF",true,"system","static","string","Binary logging format for replication","pending-reboot",
"binlog_group_commit_sync_delay",,"0-1000000",true,"engine-default","dynamic","integer","Controls how many microseconds the binary log commit waits before synchronizing the binary log file to storage. Setting binlog_group_commit_sync_delay can increase the number of parallel committing transactions on any server that has (or might have after a failover) a replica, and therefore can increase parallel execution on the replicas.","pending-reboot",
"binlog_group_commit_sync_no_delay_count",,"0-100000",true,"engine-default","dynamic","integer","The maximum number of transactions to wait for before aborting the current delay as specified by binlog_group_commit_sync_delay.","pending-reboot",
"binlog-ignore-db",,,true,"engine-default","static","list","Creates a replication ignore filter using the name of a database","pending-reboot",
"binlog_max_flush_queue_time",,"0-100000",true,"engine-default","dynamic","integer","How long in microseconds to keep reading transactions from the flush queue before proceeding with the group commit (and syncing the log to disk, if sync_binlog is greater than 0). If the value is 0 (the default), there is no timeout and the server keeps reading new transactions until the queue is empty.","pending-reboot",
"binlog_order_commits",,"0,1",true,"engine-default","dynamic","boolean","If this variable is enabled (the default), transactions are committed in the same order they are written to the binary log. If disabled, transactions may be committed in parallel.","pending-reboot",
"binlog_row_image",,"full,minimal,noblob",true,"engine-default","dynamic","string","Whether the server logs full or minimal rows with row-based replication.","pending-reboot",
"binlog_row_metadata",,"full,minimal",true,"engine-default","dynamic","string","Configures the amount of table metadata added to the binary log when using row-based logging.","pending-reboot",
"binlog_rows_query_log_events",,"0,1",true,"engine-default","dynamic","boolean","When enabled, it causes a MySQL 5.6.2 or later server to write informational log events such as row query log events into its binary log.","pending-reboot",
"binlog_row_value_options",,"PARTIAL_JSON, ",true,"engine-default","dynamic","string","When set to PARTIAL_JSON, this option enables a space-efficient row-based binary log format for UPDATE statements that modify a JSON value using only the functions JSON_SET, JSON_REPLACE, and JSON_REMOVE. For such updates, only the modified parts of the JSON document are included in the binary log, so small changes of big documents may need significantly less space.","pending-reboot",
"binlog_stmt_cache_size",,"4096-18446744073709547520",true,"engine-default","dynamic","integer","This variable determines the size of the cache for the binary log to hold nontransactional statements issued during a transaction.","pending-reboot",
"binlog_transaction_compression",,"ON,OFF",true,"engine-default","dynamic","string","Enables compression for transactions that are written to binary log files on this server","pending-reboot",
"binlog_transaction_compression_level_zstd",,"1-22",true,"engine-default","dynamic","integer","Sets the compression level for binary log transaction compression on this server, which is enabled by the binlog_transaction_compression system variable.","pending-reboot",
"binlog_transaction_dependency_history_size",,"1-1000000",true,"engine-default","dynamic","integer","The limit on the number of row hashes kept in memory to track the last transaction that modified a given row","pending-reboot",
"binlog_transaction_dependency_tracking",,"COMMIT_ORDER,WRITESET,WRITESET_SESSION",true,"engine-default","dynamic","string","For a replication source server that has multithreaded replicas, specifies the source of dependency information that the source records in the binary log to help replicas determine which transactions can be executed in parallel.","pending-reboot",
"bulk_insert_buffer_size",,"0-18446744073709547520",true,"engine-default","dynamic","integer","Limits the size of the MyISAM cache tree in bytes per thread.","pending-reboot",
"character_set_client",,"big5,dec8,cp850,hp8,koi8r,latin1,latin2,swe7,ascii,ujis,sjis,hebrew,tis620,euckr,koi8u,gb2312,greek,cp1250,gbk,latin5,armscii8,utf8,cp866,keybcs2,macce,macroman,cp852,latin7,utf8mb4,cp1251,cp1256,cp1257,binary,geostd8,cp932,eucjpms",true,"engine-default","dynamic","string","The character set for statements that arrive from the client.","pending-reboot",
"character-set-client-handshake",,"0,1",true,"engine-default","static","boolean","Don't ignore character set information sent by the client.","pending-reboot",
"character_set_connection",,"big5,dec8,cp850,hp8,koi8r,latin1,latin2,swe7,ascii,ujis,sjis,hebrew,tis620,euckr,koi8u,gb2312,greek,cp1250,gbk,latin5,armscii8,utf8,ucs2,cp866,keybcs2,macce,macroman,cp852,latin7,utf8mb4,cp1251,utf16,cp1256,cp1257,utf32,binary,geostd8,cp932,eucjpms",true,"engine-default","dynamic","string","The character set used for literals that do not have a character set introducer and for number-to-string conversion.","pending-reboot",
"character_set_database",,"big5,dec8,cp850,hp8,koi8r,latin1,latin2,swe7,ascii,ujis,sjis,hebrew,tis620,euckr,koi8u,gb2312,greek,cp1250,gbk,latin5,armscii8,utf8,ucs2,cp866,keybcs2,macce,macroman,cp852,latin7,utf8mb4,cp1251,utf16,cp1256,cp1257,utf32,binary,geostd8,cp932,eucjpms",true,"engine-default","dynamic","string","The character set used by the default database.","pending-reboot",
"character_set_filesystem",,"big5,dec8,cp850,hp8,koi8r,latin1,latin2,swe7,ascii,ujis,sjis,hebrew,tis620,euckr,koi8u,gb2312,greek,cp1250,gbk,latin5,armscii8,utf8,ucs2,cp866,keybcs2,macce,macroman,cp852,latin7,utf8mb4,cp1251,utf16,cp1256,cp1257,utf32,binary,geostd8,cp932,eucjpms",true,"engine-default","dynamic","string","The file system character set.","pending-reboot",
"character_set_results",,"big5,dec8,cp850,hp8,koi8r,latin1,latin2,swe7,ascii,ujis,sjis,hebrew,tis620,euckr,koi8u,gb2312,greek,cp1250,gbk,latin5,armscii8,utf8,ucs2,cp866,keybcs2,macce,macroman,cp852,latin7,utf8mb4,cp1251,utf16,cp1256,cp1257,utf32,binary,geostd8,cp932,eucjpms",true,"engine-default","dynamic","string","The character set used for returning query results to the client.","pending-reboot",
"character_set_server",,"big5,dec8,cp850,hp8,koi8r,latin1,latin2,swe7,ascii,ujis,sjis,hebrew,tis620,euckr,koi8u,gb2312,greek,cp1250,gbk,latin5,armscii8,utf8,ucs2,cp866,keybcs2,macce,macroman,cp852,latin7,utf8mb4,cp1251,utf16,cp1256,cp1257,utf32,binary,geostd8,cp932,eucjpms",true,"engine-default","dynamic","string","The server's default character set.","pending-reboot",
"check_proxy_users",,"0,1",true,"engine-default","dynamic","boolean","Controls whether the mysql_native_password and sha256_password built-in authentication plugins support proxy users.","pending-reboot",
"collation_connection",,"big5_chinese_ci,big5_bin,dec8_swedish_ci,dec8_bin,cp850_general_ci,cp850_bin,hp8_english_ci,hp8_bin,koi8r_general_ci,koi8r_bin,latin1_german1_ci,latin1_swedish_ci,latin1_danish_ci,latin1_german2_ci,latin1_bin,latin1_general_ci,latin1_general_cs,latin1_spanish_ci,latin2_czech_cs,latin2_general_ci,latin2_hungarian_ci,latin2_croatian_ci,latin2_bin,swe7_swedish_ci,swe7_bin,ascii_general_ci,ascii_bin,ujis_japanese_ci,ujis_bin,sjis_japanese_ci,sjis_bin,hebrew_general_ci,hebrew_bin,tis620_thai_ci,tis620_bin,euckr_korean_ci,euckr_bin,koi8u_general_ci,koi8u_bin,gb2312_chinese_ci,gb2312_bin,greek_general_ci,greek_bin,cp1250_general_ci,cp1250_czech_cs,cp1250_croatian_ci,cp1250_bin,cp1250_polish_ci,gbk_chinese_ci,gbk_bin,latin5_turkish_ci,latin5_bin,armscii8_general_ci,armscii8_bin,utf8_general_ci,utf8_bin,utf8_unicode_ci,utf8_icelandic_ci,utf8_latvian_ci,utf8_romanian_ci,utf8_slovenian_ci,utf8_polish_ci,utf8_estonian_ci,utf8_spanish_ci,utf8_swedish_ci,utf8_turkish_ci,utf8_czech_ci,utf8_danish_ci,utf8_lithuanian_ci,utf8_slovak_ci,utf8_spanish2_ci,utf8_roman_ci,utf8_persian_ci,utf8_esperanto_ci,utf8_hungarian_ci,utf8_sinhala_ci,ucs2_general_ci,ucs2_bin,ucs2_unicode_ci,ucs2_icelandic_ci,ucs2_latvian_ci,ucs2_romanian_ci,ucs2_slovenian_ci,ucs2_polish_ci,ucs2_estonian_ci,ucs2_spanish_ci,ucs2_swedish_ci,ucs2_turkish_ci,ucs2_czech_ci,ucs2_danish_ci,ucs2_lithuanian_ci,ucs2_slovak_ci,ucs2_spanish2_ci,ucs2_roman_ci,ucs2_persian_ci,ucs2_esperanto_ci,ucs2_hungarian_ci,ucs2_sinhala_ci,cp866_general_ci,cp866_bin,keybcs2_general_ci,keybcs2_bin,macce_general_ci,macce_bin,macroman_general_ci,macroman_bin,cp852_general_ci,cp852_bin,latin7_estonian_cs,latin7_general_ci,latin7_general_cs,latin7_bin,utf8mb4_general_ci,utf8mb4_bin,utf8mb4_unicode_ci,utf8mb4_icelandic_ci,utf8mb4_latvian_ci,utf8mb4_romanian_ci,utf8mb4_slovenian_ci,utf8mb4_polish_ci,utf8mb4_estonian_ci,utf8mb4_spanish_ci,utf8mb4_swedish_ci,utf8mb4_turkish_ci,utf8mb4_czech_ci,utf8mb4_danish_ci,utf8mb4_lithuanian_ci,utf8mb4_slovak_ci,utf8mb4_spanish2_ci,utf8mb4_roman_ci,utf8mb4_persian_ci,utf8mb4_esperanto_ci,utf8mb4_hungarian_ci,utf8mb4_sinhala_ci,cp1251_bulgarian_ci,cp1251_ukrainian_ci,cp1251_bin,cp1251_general_ci,cp1251_general_cs,utf16_general_ci,utf16_bin,utf16_unicode_ci,utf16_icelandic_ci,utf16_latvian_ci,utf16_romanian_ci,utf16_slovenian_ci,utf16_polish_ci,utf16_estonian_ci,utf16_spanish_ci,utf16_swedish_ci,utf16_turkish_ci,utf16_czech_ci,utf16_danish_ci,utf16_lithuanian_ci,utf16_slovak_ci,utf16_spanish2_ci,utf16_roman_ci,utf16_persian_ci,utf16_esperanto_ci,utf16_hungarian_ci,utf16_sinhala_ci,cp1256_general_ci,cp1256_bin,cp1257_lithuanian_ci,cp1257_bin,cp1257_general_ci,utf32_general_ci,utf32_bin,utf32_unicode_ci,utf32_icelandic_ci,utf32_latvian_ci,utf32_romanian_ci,utf32_slovenian_ci,utf32_polish_ci,utf32_estonian_ci,utf32_spanish_ci,utf32_swedish_ci,utf32_turkish_ci,utf32_czech_ci,utf32_danish_ci,utf32_lithuanian_ci,utf32_slovak_ci,utf32_spanish2_ci,utf32_roman_ci,utf32_persian_ci,utf32_esperanto_ci,utf32_hungarian_ci,utf32_sinhala_ci,binary,geostd8_general_ci,geostd8_bin,cp932_japanese_ci,cp932_bin,eucjpms_japanese_ci,eucjpms_bin,utf8mb4_0900_ai_ci,utf8mb4_0900_as_ci,utf8mb4_0900_as_cs,utf8mb4_0900_bin",true,"engine-default","dynamic","string","The collation of the connection character set.","pending-reboot",
"collation_server",,"big5_chinese_ci,big5_bin,dec8_swedish_ci,dec8_bin,cp850_general_ci,cp850_bin,hp8_english_ci,hp8_bin,koi8r_general_ci,koi8r_bin,latin1_german1_ci,latin1_swedish_ci,latin1_danish_ci,latin1_german2_ci,latin1_bin,latin1_general_ci,latin1_general_cs,latin1_spanish_ci,latin2_czech_cs,latin2_general_ci,latin2_hungarian_ci,latin2_croatian_ci,latin2_bin,swe7_swedish_ci,swe7_bin,ascii_general_ci,ascii_bin,ujis_japanese_ci,ujis_bin,sjis_japanese_ci,sjis_bin,hebrew_general_ci,hebrew_bin,tis620_thai_ci,tis620_bin,euckr_korean_ci,euckr_bin,koi8u_general_ci,koi8u_bin,gb2312_chinese_ci,gb2312_bin,greek_general_ci,greek_bin,cp1250_general_ci,cp1250_czech_cs,cp1250_croatian_ci,cp1250_bin,cp1250_polish_ci,gbk_chinese_ci,gbk_bin,latin5_turkish_ci,latin5_bin,armscii8_general_ci,armscii8_bin,utf8_general_ci,utf8_bin,utf8_unicode_ci,utf8_icelandic_ci,utf8_latvian_ci,utf8_romanian_ci,utf8_slovenian_ci,utf8_polish_ci,utf8_estonian_ci,utf8_spanish_ci,utf8_swedish_ci,utf8_turkish_ci,utf8_czech_ci,utf8_danish_ci,utf8_lithuanian_ci,utf8_slovak_ci,utf8_spanish2_ci,utf8_roman_ci,utf8_persian_ci,utf8_esperanto_ci,utf8_hungarian_ci,utf8_sinhala_ci,ucs2_general_ci,ucs2_bin,ucs2_unicode_ci,ucs2_icelandic_ci,ucs2_latvian_ci,ucs2_romanian_ci,ucs2_slovenian_ci,ucs2_polish_ci,ucs2_estonian_ci,ucs2_spanish_ci,ucs2_swedish_ci,ucs2_turkish_ci,ucs2_czech_ci,ucs2_danish_ci,ucs2_lithuanian_ci,ucs2_slovak_ci,ucs2_spanish2_ci,ucs2_roman_ci,ucs2_persian_ci,ucs2_esperanto_ci,ucs2_hungarian_ci,ucs2_sinhala_ci,cp866_general_ci,cp866_bin,keybcs2_general_ci,keybcs2_bin,macce_general_ci,macce_bin,macroman_general_ci,macroman_bin,cp852_general_ci,cp852_bin,latin7_estonian_cs,latin7_general_ci,latin7_general_cs,latin7_bin,utf8mb4_general_ci,utf8mb4_bin,utf8mb4_unicode_ci,utf8mb4_icelandic_ci,utf8mb4_latvian_ci,utf8mb4_romanian_ci,utf8mb4_slovenian_ci,utf8mb4_polish_ci,utf8mb4_estonian_ci,utf8mb4_spanish_ci,utf8mb4_swedish_ci,utf8mb4_turkish_ci,utf8mb4_czech_ci,utf8mb4_danish_ci,utf8mb4_lithuanian_ci,utf8mb4_slovak_ci,utf8mb4_spanish2_ci,utf8mb4_roman_ci,utf8mb4_persian_ci,utf8mb4_esperanto_ci,utf8mb4_hungarian_ci,utf8mb4_sinhala_ci,cp1251_bulgarian_ci,cp1251_ukrainian_ci,cp1251_bin,cp1251_general_ci,cp1251_general_cs,utf16_general_ci,utf16_bin,utf16_unicode_ci,utf16_icelandic_ci,utf16_latvian_ci,utf16_romanian_ci,utf16_slovenian_ci,utf16_polish_ci,utf16_estonian_ci,utf16_spanish_ci,utf16_swedish_ci,utf16_turkish_ci,utf16_czech_ci,utf16_danish_ci,utf16_lithuanian_ci,utf16_slovak_ci,utf16_spanish2_ci,utf16_roman_ci,utf16_persian_ci,utf16_esperanto_ci,utf16_hungarian_ci,utf16_sinhala_ci,cp1256_general_ci,cp1256_bin,cp1257_lithuanian_ci,cp1257_bin,cp1257_general_ci,utf32_general_ci,utf32_bin,utf32_unicode_ci,utf32_icelandic_ci,utf32_latvian_ci,utf32_romanian_ci,utf32_slovenian_ci,utf32_polish_ci,utf32_estonian_ci,utf32_spanish_ci,utf32_swedish_ci,utf32_turkish_ci,utf32_czech_ci,utf32_danish_ci,utf32_lithuanian_ci,utf32_slovak_ci,utf32_spanish2_ci,utf32_roman_ci,utf32_persian_ci,utf32_esperanto_ci,utf32_hungarian_ci,utf32_sinhala_ci,binary,geostd8_general_ci,geostd8_bin,cp932_japanese_ci,cp932_bin,eucjpms_japanese_ci,eucjpms_bin,utf8mb4_0900_ai_ci,utf8mb4_0900_as_ci,utf8mb4_0900_as_cs,utf8mb4_0900_bin",true,"engine-default","dynamic","string","The server's default collation.","pending-reboot",
"completion_type",,"0-2",true,"engine-default","dynamic","integer","The transaction completion type (0 - default, 1 - chain, 2 - release)","pending-reboot",
"concurrent_insert",,"0-2",true,"engine-default","dynamic","integer","Allows INSERT and SELECT statements to run concurrently for MyISAM tables that have no free blocks in the middle of the data file.","pending-reboot",
"connect_timeout",,"2-31536000",true,"engine-default","dynamic","integer","The number of seconds that the MySQLd  server waits for a connect packet before responding with Bad handshake.","pending-reboot",
"core-file",,"0,1",false,"engine-default","static","boolean","Write a core file if mysqld dies.","pending-reboot",
"cte_max_recursion_depth",,"0-4294967295",true,"engine-default","dynamic","integer","Abort a recursive common table expression if it does more than this number of iterations.","pending-reboot",
"datadir","/rdsdbdata/db/",,false,"system","static","string","MySQL data directory","pending-reboot",
"default_authentication_plugin","mysql_native_password","mysql_native_password,sha256_password,caching_sha2_password",false,"engine-default","static","string","The default authentication plugin","pending-reboot",
"default_password_lifetime","0","0-65535",true,"system","dynamic","integer","Defines the global automatic password expiration policy.","pending-reboot",
"default_storage_engine","InnoDB","InnoDB,MRG_MYISAM,BLACKHOLE,CSV,MEMORY,FEDERATED,ARCHIVE,MyISAM",false,"system","dynamic","string","The default storage engine (table type).","pending-reboot",
"default_time_zone",,,false,"engine-default","static","string","Server current time zone","pending-reboot",
"default_tmp_storage_engine","InnoDB","InnoDB,MyISAM",true,"system","static","string","The default storage engine for TEMPORARY tables.","pending-reboot",
"default_week_format",,"0-7",true,"engine-default","dynamic","integer","The default mode value to use for the WEEK() function.","pending-reboot",
"delayed_insert_limit",,"1-9223372036854775807",true,"engine-default","dynamic","integer","After inserting delayed_insert_limit delayed rows, the INSERT DELAYED handler thread checks whether there are any SELECT statements pending. If so, it allows them to execute before continuing to insert delayed rows.","pending-reboot",
"delayed_insert_timeout",,"1-31536000",true,"engine-default","dynamic","integer","How many seconds an INSERT DELAYED handler thread should wait for INSERT statements before terminating.","pending-reboot",
"delayed_queue_size",,"1-9223372036854775807",true,"engine-default","dynamic","integer","If the queue becomes full, any client that issues an INSERT DELAYED statement waits until there is room in the queue again.","pending-reboot",
"delay_key_write",,"OFF,ON,ALL",true,"engine-default","dynamic","string","Determines when keys are flushed for MyISAM tables","pending-reboot",
"div_precision_increment",,"0-30",true,"engine-default","dynamic","integer","Number of digits by which to increase the scale of the result of division operations.","pending-reboot",
"end_markers_in_json",,"0,1",true,"engine-default","dynamic","boolean","Whether optimizer JSON output should add end markers.","pending-reboot",
"enforce_gtid_consistency",,"OFF,WARN,ON",true,"engine-default","static","string","Prevents execution of statements that cannot be logged in a transactionally safe manner","pending-reboot",
"eq_range_index_dive_limit",,"0-4294967295",true,"engine-default","dynamic","integer","Number of equality ranges when the optimizer should switch from using index dives to index statistics.","pending-reboot",
"event_scheduler",,"ON,OFF",true,"engine-default","dynamic","string","Indicates the status of the Event Scheduler","pending-reboot",
"explicit_defaults_for_timestamp","1","0,1",true,"system","static","boolean","Needed for 5.6.7","pending-reboot",
"flush",,"0,1",false,"engine-default","dynamic","boolean","If ON, the server flushes all changes to disk after each SQL statement.","pending-reboot",
"flush_time",,"0-31536000",true,"engine-default","dynamic","integer","Frees up resources and synchronize unflushed data to disk. Recommended only on systems with minimal resources.","pending-reboot",
"ft_boolean_syntax",,,false,"engine-default","dynamic","string","The list of operators supported by boolean full-text searches","pending-reboot",
"ft_max_word_len",,"10-84",true,"engine-default","static","integer","Maximum length of the word to be included in a FULLTEXT index.","pending-reboot",
"ft_min_word_len",,"1-84",true,"engine-default","static","integer","Minimum length of the word to be included in a FULLTEXT index.","pending-reboot",
"ft_query_expansion_limit",,"0-1000",true,"engine-default","static","integer","Number of top matches to use for full-text searches performed using WITH QUERY EXPANSION.","pending-reboot",
"ft_stopword_file",,"/dev/null",true,"engine-default","static","string","File for Full Search Stop Words. NULL uses Default, /dev/null to disable Stop Words","pending-reboot",
"general_log",,"0,1",true,"engine-default","dynamic","boolean","Whether the general query log is enabled","pending-reboot",
"general_log_file","/rdsdbdata/log/general/mysql-general.log",,false,"system","dynamic","string","Location of mysql general log.","pending-reboot",
"generated_random_password_length","20","5-255",true,"engine-default","dynamic","integer","generated_random_password_length","pending-reboot",
"group_concat_max_len",,"4-18446744073709547520",true,"engine-default","dynamic","integer","Maximum allowed result length in bytes for the GROUP_CONCAT().","pending-reboot",
"gtid_executed_compression_period",,"0-4294967295",true,"engine-default","dynamic","integer","Compress the mysql.gtid_executed table each time this many transactions have taken place","pending-reboot",
"gtid-mode","OFF_PERMISSIVE","OFF,OFF_PERMISSIVE,ON_PERMISSIVE,ON",true,"system","static","string","Controls whether GTID based logging is enabled and what type of transactions the logs can contain","pending-reboot",
"gtid_purged",,,false,"engine-default","dynamic","string","The set of all GTIDs that have been purged from the binary log","pending-reboot",
"histogram_generation_max_mem_size",,"1000000-18446744073709551615",true,"engine-default","dynamic","integer","The maximum amount of memory available for generating histogram statistics.","pending-reboot",
"host_cache_size",,"0-65536",true,"engine-default","dynamic","integer","The size of the internal host cache.","pending-reboot",
"information_schema_stats_expiry",,"0-31536000",true,"engine-default","dynamic","integer","The number of seconds after which mysqld server will fetch data from storage engine and replace the data in cache","pending-reboot",
"init_connect",,,true,"engine-default","dynamic","string","String to be executed by the server for each client that connects.","pending-reboot",
"innodb_adaptive_flushing",,"0,1",true,"engine-default","dynamic","boolean","Enables InnoDB Adaptive Flushing (default=on for RDS)","pending-reboot",
"innodb_adaptive_hash_index","0","0,1",true,"system","dynamic","boolean","Whether innodb adaptive hash indexes are enabled or disabled","pending-reboot",
"innodb_adaptive_hash_index_parts",,"1-512",true,"engine-default","static","integer","Partitions the adaptive hash index search system.","pending-reboot",
"innodb_adaptive_max_sleep_delay",,"0-1000000",true,"engine-default","dynamic","integer","Allows InnoDB to automatically adjust the value of innodb_thread_concurrency up or down according to the current workload.","pending-reboot",
"innodb_autoextend_increment",,"1-1000",true,"engine-default","dynamic","integer","The increment size (in MB) for extending the size of an auto-extending tablespace file when it becomes full","pending-reboot",
"innodb_autoinc_lock_mode",,"0-2",true,"engine-default","static","integer","The locking mode to use for generating auto-increment values","pending-reboot",
"innodb_buffer_pool_dump_at_shutdown","0","0,1",false,"engine-default","dynamic","boolean","Specifies whether to record the pages cached in the InnoDB buffer pool when the MySQL server is shut down.","pending-reboot",
