"名前","値","許可された値","変更可能","送信元","適用タイプ","データ型","説明","ApplyMethod","MinimumEngineVersion"
"myisam_mmap_size",,"7-922337203685477807",true,"engine-default","static","integer","Maximum amount of memory to use for memory mapping compressed MyISAM files","pending-reboot",
"myisam_sort_buffer_size",,"4-9223372036854775807",true,"engine-default","dynamic","integer","Size of the buffer that is allocated when sorting MyISAM indexes during a REPAIR TABLE or when creating indexes with CREATE INDEX or ALTER TABLE.","pending-reboot",
"myisam_stats_method",,"nulls_equal,nulls_unequal,nulls_ignored",true,"engine-default","dynamic","string","How the server treats NULL values when collecting statistics about the distribution of index values for MyISAM tables","pending-reboot",
"myisam_use_mmap",,"0,1",true,"engine-default","dynamic","boolean","Memory mapping for reading and writing MyISAM tables.","pending-reboot",
"mysql_native_password_proxy_users",,"0,1",true,"engine-default","dynamic","boolean","This variable controls whether the mysql_native_password built-in authentication plugin supports proxy users.","pending-reboot",
"net_buffer_length",,"1024-1048576",true,"engine-default","dynamic","integer","This variable should not normally be changed. For use when very little memory is available. Set it to the expected length of statements sent by clients.","pending-reboot",
"net_read_timeout",,"1-31536000",true,"engine-default","dynamic","integer","The number of seconds to wait for more data from a TCP/IP connection before aborting the read.","pending-reboot",
"net_retry_count",,"1-9223372036854775807",true,"engine-default","dynamic","integer","If a read on a communication port is interrupted, retry this many times before giving up. This value should be set quite high on freebsd because internal interrupts are sent to all threads. ","pending-reboot",
"net_write_timeout",,"1-31536000",true,"engine-default","dynamic","integer","The number of seconds to wait on TCP/IP connections for a block to be written before aborting the write. ","pending-reboot",
"ngram_token_size",,"1-10",true,"engine-default","static","integer","Defines the n-gram token size for n-gram full-text parser.","pending-reboot",
"old-style-user-limits",,"0,1",true,"engine-default","static","boolean","Enable old-style user limits.","pending-reboot",
"optimizer_prune_level",,"0,1",true,"engine-default","dynamic","boolean","Controls the heuristics applied during query optimization to prune less-promising partial plans from the optimizer search space.","pending-reboot",
"optimizer_search_depth",,"0-62",true,"engine-default","dynamic","integer","The maximum depth of search performed by the query optimizer.","pending-reboot",
"optimizer_switch",,"default,batched_key_access=on,batched_key_access=off,block_nested_loop=on,block_nested_loop=off,condition_fanout_filter=on,condition_fanout_filter=off,derived_condition_pushdown=on,derived_condition_pushdown=off,derived_merge=on,derived_merge=off,duplicateweedout=on,duplicateweedout=off,engine_condition_pushdown=on,engine_condition_pushdown=off,firstmatch=on,firstmatch=off,hash_join=on,hash_join=off,index_condition_pushdown=on,index_condition_pushdown=off,index_merge=on,index_merge=off,index_merge_intersection=on,index_merge_intersection=off,index_merge_sort_union=on,index_merge_sort_union=off,index_merge_union=on,index_merge_union=off,loosescan=on,loosescan=off,materialization=on,materialization=off,mrr=on,mrr=off,mrr_cost_based=on,mrr_cost_based=off,prefer_ordering_index=on,prefer_ordering_index=off,semijoin=on,semijoin=off,skip_scan=on,skip_scan=off,subquery_materialization_cost_based=on,subquery_materialization_cost_based=off,use_index_extensions=on,use_index_extensions=off,use_invisible_indexes=on,use_invisible_indexes=off",true,"engine-default","dynamic","list","Controls optimizer behavior. ","pending-reboot",
"optimizer_trace",,"enabled=on,enabled=off,one_line=on,one_line=off",true,"engine-default","dynamic","string","Controls how statements are traced.","pending-reboot",
"optimizer_trace_features",,"greedy_search=on,greedy_search=off,range_optimizer=on,range_optimizer=off,dynamic_range=on,dynamic_range=off,repeated_subselect=on,repeated_subselect=off",true,"engine-default","dynamic","string","Controls optimizations during statement tracing.","pending-reboot",
"optimizer_trace_limit",,"1-9223372036854775807",true,"engine-default","dynamic","integer","Controls the limit on trace retention.","pending-reboot",
"optimizer_trace_max_mem_size",,"0-18446744073709551615",true,"engine-default","dynamic","integer","Maximum allowed cumulated size of stored optimizer traces","pending-reboot",
"optimizer_trace_offset",,"-9223372036854775807-9223372036854775807",true,"engine-default","dynamic","integer","Controls the offset on trace retention.","pending-reboot",
"partial_revokes","0","0,1",false,"engine-default","dynamic","boolean","Enabling this variable makes it possible to revoke privileges partially.","pending-reboot",
"performance_schema","0","0,1",true,"system","static","boolean","Enables or disables the Performance Schema","pending-reboot",
"performance_schema_accounts_size",,"-1-1048576",true,"engine-default","static","integer","The number of rows in the Performance Schema accounts table.","pending-reboot",
"performance_schema_consumer_events_stages_current",,"0,1",true,"engine-default","static","boolean","Enable the events_stages_current consumer","pending-reboot",
"performance_schema_consumer_events_stages_history",,"0,1",true,"engine-default","static","boolean","Enable the events_stages_history consumer","pending-reboot",
"performance_schema_consumer_events_stages_history_long",,"0,1",true,"engine-default","static","boolean","Enable the events_stages_history_long consumer","pending-reboot",
"performance_schema_consumer_events_statements_current",,"0,1",true,"engine-default","static","boolean","Enable the events_statements_current consumer","pending-reboot",
"performance_schema_consumer_events_statements_history",,"0,1",true,"engine-default","static","boolean","Enable the events_statements_history consumer","pending-reboot",
"performance_schema_consumer_events_statements_history_long",,"0,1",true,"engine-default","static","boolean","Enable the events_statements_history_long consumer","pending-reboot",
"performance-schema-consumer-events-waits-current",,"ON,OFF",true,"engine-default","static","string","Configure the events-waits-current consumer.","pending-reboot",
"performance_schema_consumer_events_waits_history",,"0,1",true,"engine-default","static","boolean","Enable the events_waits_history consumer","pending-reboot",
"performance_schema_consumer_events_waits_history_long",,"0,1",true,"engine-default","static","boolean","Enable the events_waits_history_long consumer","pending-reboot",
"performance_schema_consumer_global_instrumentation",,"0,1",true,"engine-default","static","boolean","Enable the global instrumentation consumer","pending-reboot",
"performance_schema_consumer_statements_digest",,"0,1",true,"engine-default","static","boolean","Enable the statements_digest consumer","pending-reboot",
"performance_schema_consumer_thread_instrumentation",,"0,1",true,"engine-default","static","boolean","Enable the thread instrumentation consumer","pending-reboot",
"performance_schema_digests_size",,"-1-1048576",true,"engine-default","static","integer","The maximum number of rows in the events_statements_summary_by_digest table.","pending-reboot",
"performance_schema_events_stages_history_long_size",,"-1-1048576",true,"engine-default","static","integer","The number of rows in the events_stages_history_long table.","pending-reboot",
"performance_schema_events_stages_history_size",,"-1-1024",true,"engine-default","static","integer","The number of rows per thread in the events_stages_history table.","pending-reboot",
"performance_schema_events_statements_history_long_size",,"-1-1048576",true,"engine-default","static","integer","The number of rows in the events_statements_history_long table.","pending-reboot",
"performance_schema_events_statements_history_size",,"-1-1024",true,"engine-default","static","integer","The number of rows per thread in the events_statements_history table.","pending-reboot",
"performance_schema_events_transactions_history_long_size",,"-1-1048576",true,"engine-default","static","integer","The number of rows in the events_transactions_history_long table.","pending-reboot",
"performance_schema_events_transactions_history_size",,"-1-1024",true,"engine-default","static","integer","The number of rows per thread in the events_transactions_history table.","pending-reboot",
"performance_schema_events_waits_history_long_size",,"-1-1048576",true,"engine-default","static","integer","The number of rows in the events_waits_history_long table.","pending-reboot",
"performance_schema_events_waits_history_size",,"-1-1024",true,"engine-default","static","integer","The number of rows per thread in the events_waits_history table.","pending-reboot",
"performance_schema_hosts_size",,"-1-1048576",true,"engine-default","static","integer","The number of rows in the hosts table.","pending-reboot",
"performance-schema-instrument",,,true,"engine-default","static","string","Configure a Performance Schema instrument. The name may be given as a pattern to configure instruments that match the pattern.","pending-reboot",
"performance_schema_max_cond_classes",,"0-256",true,"engine-default","static","integer","The maximum number of condition instruments.","pending-reboot",
"performance_schema_max_cond_instances",,"-1-1048576",true,"engine-default","static","integer","The maximum number of instrumented condition objects.","pending-reboot",
"performance_schema_max_digest_length",,"-1-1048576",true,"engine-default","static","integer","The maximum number of bytes available for computing statement digests.","pending-reboot",
"performance_schema_max_digest_sample_age",,"0-1048576",true,"engine-default","dynamic","integer","The time in seconds after which a previous query sample is considered old. When the value is 0, queries are sampled once. When the value is greater than zero, queries are re sampled if the last sample is more than performance_schema_max_digest_sample_age seconds old.","pending-reboot",
"performance_schema_max_file_classes",,"0-256",true,"engine-default","static","integer","The maximum number of file instruments.","pending-reboot",
"performance_schema_max_file_handles",,"0-1048576",true,"engine-default","static","integer","The maximum number of opened file objects.","pending-reboot",
"performance_schema_max_file_instances",,"-1-1048576",true,"engine-default","static","integer","The maximum number of instrumented file objects.","pending-reboot",
"performance_schema_max_index_stat",,"-1-1048576",true,"engine-default","static","integer","The maximum number of indexes for which the Performance Schema maintains statistics.","pending-reboot",
"performance_schema_max_memory_classes",,"-1-1024",true,"engine-default","static","integer","The maximum number of memory instruments.","pending-reboot",
"performance_schema_max_metadata_locks",,"-1-104857600",true,"engine-default","static","integer","The maximum number of metadata lock instruments.","pending-reboot",
"performance_schema_max_mutex_classes",,"0-256",true,"engine-default","static","integer","The maximum number of mutex instruments.","pending-reboot",
"performance_schema_max_mutex_instances",,"-1-104857600",true,"engine-default","static","integer","The maximum number of instrumented mutex objects.","pending-reboot",
"performance_schema_max_prepared_statements_instances",,"-1-1048576",true,"engine-default","static","integer","The maximum number of rows in the prepared_statements_instances table.","pending-reboot",
"performance_schema_max_program_instances",,"-1-1048576",true,"engine-default","static","integer","The maximum number of stored programs for which the Performance Schema maintains statistics.","pending-reboot",
"performance_schema_max_rwlock_classes",,"0-256",true,"engine-default","static","integer","The maximum number of rwlock instruments.","pending-reboot",
"performance_schema_max_rwlock_instances",,"-1-104857600",true,"engine-default","static","integer","The maximum number of instrumented rwlock objects.","pending-reboot",
"performance_schema_max_socket_classes",,"0-256",true,"engine-default","static","integer","The maximum number of socket instruments.","pending-reboot",
"performance_schema_max_socket_instances",,"-1-1048576",true,"engine-default","static","integer","The maximum number of instrumented socket objects.","pending-reboot",
"performance_schema_max_sql_text_length",,"-1-1048576",true,"engine-default","static","integer","The maximum number of bytes used to store SQL statements in the SQL_TEXT column of the events_statements_current, events_statements_history, and events_statements_history_long statement event tables.","pending-reboot",
"performance_schema_max_stage_classes",,"0-256",true,"engine-default","static","integer","The maximum number of stage instruments.","pending-reboot",
"performance_schema_max_statement_classes",,"0-256",true,"engine-default","static","integer","The maximum number of statement instruments.","pending-reboot",
"performance_schema_max_statement_stack",,"1-256",true,"engine-default","static","integer","The maximum depth of nested stored program calls for which the Performance Schema maintains statistics.","pending-reboot",
"performance_schema_max_table_handles",,"-1-1048576",true,"engine-default","static","integer","The maximum number of opened table objects.","pending-reboot",
"performance_schema_max_table_instances",,"-1-1048576",true,"engine-default","static","integer","The maximum number of instrumented table objects.","pending-reboot",
"performance_schema_max_table_lock_stat",,"-1-1048576",true,"engine-default","static","integer","The maximum number of tables for which the Performance Schema maintains lock statistics.","pending-reboot",
"performance_schema_max_thread_classes",,"0-256",true,"engine-default","static","integer","The maximum number of thread instruments.","pending-reboot",
"performance_schema_max_thread_instances",,"-1-1048576",true,"engine-default","static","integer","The maximum number of instrumented thread objects.","pending-reboot",
"performance_schema_session_connect_attrs_size",,"-1-1048576",true,"engine-default","static","integer","The amount of preallocated memory per thread used to hold connection attribute strings.","pending-reboot",
"performance_schema_setup_actors_size",,"0-1024",true,"engine-default","static","integer","The number of rows in the setup_actors table.","pending-reboot",
"performance_schema_setup_objects_size",,"-1-1048576",true,"engine-default","static","integer","The number of rows in the setup_objects table.","pending-reboot",
"performance_schema_show_processlist",,"0,1",true,"engine-default","dynamic","boolean","The SHOW PROCESSLIST statement provides process information by collecting thread data from all active threads. To see how this parameter affect how this information is gatehred please consult the MySQL documentation","pending-reboot",
"performance_schema_users_size",,"-1-1048576",true,"engine-default","static","integer","The number of rows in the users table.","pending-reboot",
"pid_file","/rdsdbdata/log/mysql-{EndPointPort}.pid",,false,"system","static","string","The path name of the process ID file. This file is used by other programs such as MySQLd_safe to determine the server's process ID.","pending-reboot",
"plugin_dir",,,false,"system","static","string","Directory searched by systems dynamic linker for UDF object files. Otherwise, user-defined function object files must be located the default directory.","pending-reboot",
"port","{EndPointPort}",,false,"system","static","integer","The number of the port on which the server listens for TCP/IP connections.","pending-reboot",
"preload_buffer_size",,"1024-1073741824",true,"engine-default","dynamic","integer","The size of the buffer that is allocated when preloading indexes.","pending-reboot",
"profiling_history_size",,"0-100",true,"engine-default","dynamic","integer","The number of statements for which to maintain profiling if profiling is enabled.","pending-reboot",
"query_alloc_block_size",,"1024-18446744073709547520",true,"engine-default","dynamic","integer","The allocation size of memory blocks that are allocated for objects created during statement parsing and execution. May help resolve fragmentation problems.","pending-reboot",
"query_prealloc_size",,"8192-18446744073709547520",true,"engine-default","dynamic","integer","Increased size might help improve perf for complex queries (i.e. Reduces server memory allocation)","pending-reboot",
"range_alloc_block_size",,"4096-18446744073709547520",true,"engine-default","dynamic","integer","The size of blocks that are allocated when doing range optimization.","pending-reboot",
"range_optimizer_max_mem_size",,"0-18446744073709551615",true,"engine-default","dynamic","integer","The limit on memory consumption for the range optimizer.","pending-reboot",
"rds.change_data_capture_streaming",,"0,1",true,"system","static","boolean","Enable/disable change data capture streaming.","pending-reboot",
"read_buffer_size","262144","8200-2147479552",true,"system","dynamic","integer","Each thread that does a sequential scan allocates this buffer. Increased value may help perf if performing many sequential scans.","pending-reboot",
"read_only","0","0,1",true,"system","dynamic","boolean","When it is enabled, the server permits no updates except from updates performed by replica threads.","pending-reboot",
"read_rnd_buffer_size","524288","8200-2147479552",true,"system","dynamic","integer","Avoids disk reads when reading rows in sorted order following a key-sort operation. Large values can improve ORDER BY perf.","pending-reboot",
"regexp_stack_limit",,"0-2147483647",true,"engine-default","dynamic","integer","Stack size limit for regular expressions matches.","pending-reboot",
"regexp_time_limit",,"0-2147483647",true,"engine-default","dynamic","integer","Timeout for regular expressions matches, in steps of the match engine, typically on the order of milliseconds","pending-reboot",
"relay-log","/rdsdbdata/log/relaylog/relaylog",,false,"system","static","string","The basename for the relay log.","pending-reboot",
"relay_log_recovery","1","0,1",false,"system","dynamic","boolean","Enables automatic relay log recovery immediately following server startup.","pending-reboot",
"relay-log-space-limit",,"0-4294967295",true,"engine-default","static","integer","The maximum amount of space to use for all relay logs.","pending-reboot",
"replica_checkpoint_group",,"32-524280",true,"engine-default","dynamic","integer","Sets the maximum number of transactions that can be processed by a multi-threaded replica before a checkpoint operation is called to update its status as shown by SHOW REPLICA STATUS.","pending-reboot",
"replica_checkpoint_period",,"1-4294967295",true,"engine-default","dynamic","integer","Sets the maximum time (in milliseconds) that is allowed to pass before a checkpoint operation is called to update the status of a multi-threaded replica as shown by SHOW REPLICA STATUS.","pending-reboot",
"replica_parallel_type",,"DATABASE,LOGICAL_CLOCK",true,"engine-default","dynamic","string","Enable parallel execution on the replica of all uncommitted threads already in the prepare phase, without violating consistency.","pending-reboot",
"replica_parallel_workers",,"0-1024",true,"engine-default","dynamic","integer","Sets the number of replica worker threads for executing replication events (transactions) in parallel. Setting this variable to 0 (the default) disables parallel execution.","pending-reboot",
"replica_pending_jobs_size_max",,"1024-18446744073709547520",true,"engine-default","dynamic","integer","For multithreaded replicas, this option sets the maximum amount of memory (in bytes) available to replica worker queues holding events not yet applied.","pending-reboot",
"replica_preserve_commit_order",,"ON,OFF",true,"engine-default","dynamic","string","For a replica with binary logging enabled, setting replica_preserve_commit_order=1 guarantees transactions are written to the replica binary log in the same order they appear in the relay logs","pending-reboot",
"replica-skip-errors",,"OFF,all,ddl_exist_errors,<integer>",true,"engine-default","static","list","This variable causes the replica SQL thread to continue replication when a statement returns any of the errors listed in the variable value.","pending-reboot",
"replica_sql_verify_checksum",,"0,1",true,"engine-default","dynamic","boolean","When this option is enabled, the replica examines checksums read from the relay log, in the event of a mismatch, the replica stops with an error.","pending-reboot",
"replicate-do-db",,,true,"engine-default","dynamic","list","Creates a replication filter using the name of a database","pending-reboot",
"replicate-do-table",,,true,"engine-default","dynamic","list","Creates a replication filter using the name of a table","pending-reboot",
"replicate-ignore-db",,,true,"engine-default","dynamic","list","Creates a replication ignore filter using the name of a database","pending-reboot",
"replicate-ignore-table",,,true,"engine-default","dynamic","list","Creates a replication ignore filter using the name of a table","pending-reboot",
"replicate-wild-do-table",,,true,"engine-default","dynamic","list","Creates a replication filter using the pattern of a table name","pending-reboot",
"replicate-wild-ignore-table",,,true,"engine-default","dynamic","list","Creates a replication ignore filter using the pattern of a table name","pending-reboot",
"replica_transaction_retries",,"0-4294967295",true,"engine-default","dynamic","integer","Sets the maximum number of times for replication SQL threads on a single-threaded or multithreaded replica to automatically retry failed transactions before stopping.","pending-reboot",
"replica_type_conversions",,"ALL_LOSSY, ALL_NON_LOSSY, ALL_SIGNED, ALL_UNSIGNED",true,"engine-default","static","list","Set of replica type conversions that are enabled. Legal values are: ALL_LOSSY to enable lossy conversions and ALL_NON_LOSSY to enable non-lossy conversions. If the variable is assigned the empty set, no conversions are allowed and it is expected that the types match exactly.","pending-reboot",
"require_secure_transport",,"ON,OFF",true,"engine-default","dynamic","string","Whether client connections to the server are required to use some form of secure transport.","pending-reboot",
"rpl_read_size",,"8192-4294959104",true,"engine-default","dynamic","integer","Sets the minimum amount of data in bytes which is read from binary log files and relay log files.","pending-reboot",
"safe-user-create",,"0,1",true,"engine-default","static","boolean","If this option is enabled, a user cannot create new MySQL users by using the GRANT  statement unless the user has the INSERT privilege for the mysql.user table or any column in the table.","pending-reboot",
"schema_definition_cache",,"256-524288",true,"engine-default","dynamic","integer","Defines a limit for the number of schema definition objects, both used and unused, that can be kept in the dictionary object cache.","pending-reboot",
"secure_file_priv","/tmp",,false,"system","static","string","Limits the effect of LOAD_FILE(), LOAD_DATA, and SELECT ??? INTO OUTFILE to specified directory.","pending-reboot",
"server_audit_events",,"CONNECT,QUERY,QUERY_DCL,QUERY_DDL,QUERY_DML,TABLE",true,"engine-default","dynamic","list","If set it specifies the set of types of events to log","pending-reboot",
"server_audit_excl_users",,,true,"engine-default","dynamic","string","If not empty, it contains the list of users whose activity will NOT be logged","pending-reboot",
"server_audit_incl_users",,,true,"engine-default","dynamic","string","If not empty, it contains a comma-delimited list of users whose activity will be logged","pending-reboot",
"server_audit_logging",,"0,1",true,"engine-default","dynamic","boolean","Enables audit logging","pending-reboot",
"server_audit_logs_upload","0","0,1",true,"engine-default","dynamic","boolean","Enables audit log upload to CloudWatch Logs","pending-reboot",
"server_id","{ServerId}",,false,"system","dynamic","integer","Integer value used to identify the instance in a replication group","pending-reboot",
"skip-character-set-client-handshake",,"0,1",true,"engine-default","static","boolean","Ignore character set information sent by the client.","pending-reboot",
"skip_external_locking",,"0,1",false,"engine-default","static","boolean","Uses OS locking instead of internal","pending-reboot",
"skip_name_resolve","1","0,1",false,"system","static","boolean","Host names are not resolved. All Host column values in the grant tables must be IP numbers or localhost.","pending-reboot",
"skip-replica-start","1","0,1",false,"system","static","boolean","Tells the replica server not to start the replica threads when the server starts.","pending-reboot",
"skip_show_database",,"0,1",true,"engine-default","static","boolean","SHOW DATABASES statement is allowed only to users who have the SHOW DATABASES privilege","pending-reboot",
"slow_launch_time",,"0-31536000",true,"engine-default","dynamic","integer","Increments Slow_launch_threads if creating thread takes longer than this many seconds.","pending-reboot",
"slow_query_log",,"0,1",true,"engine-default","dynamic","boolean","Enable or disable the slow query log","pending-reboot",
"slow_query_log_file","/rdsdbdata/log/slowquery/mysql-slowquery.log",,false,"system","dynamic","string","Location of the mysql slow query log file.","pending-reboot",
"socket","/tmp/mysql.sock",,false,"system","static","string","(UNIX) socket file and (WINDOWS) named pipe used for local connections.","pending-reboot",
