"名前","値","許可された値","変更可能","送信元","適用タイプ","データ型","説明","ApplyMethod","MinimumEngineVersion"
"tmp_table_size",,"1024-18446744073709551615",true,"engine-default","dynamic","integer","If an in-memory temporary table exceeds the limit, MySQL automatically converts it to an on-disk MyISAM table. Increased value can improve perf for many advanced GROUP BY queries.","pending-reboot",
"transaction_alloc_block_size",,"1024-18446744073709547520",true,"engine-default","dynamic","integer","The amount in bytes by which to increase a per-transaction memory pool which needs memory.","pending-reboot",
"transaction_prealloc_size",,"1024-18446744073709547520",true,"engine-default","dynamic","integer","There is a per-transaction memory pool from which various transaction-related allocations take memory. For every allocation that cannot be satisfied from the pool because it has insufficient memory available, the pool is incremented.","pending-reboot",
"tx_isolation",,"READ-UNCOMMITTED,READ-COMMITTED,REPEATABLE-READ,SERIALIZABLE",true,"engine-default","dynamic","string","Sets the default transaction isolation level.","pending-reboot",
"updatable_views_with_limit",,"0,1",true,"engine-default","dynamic","boolean","This variable controls whether updates to a view can be made when the view does not contain all columns of the primary key defined in the underlying table, if the update statement contains a LIMIT clause (Often generated by GUI tools).","pending-reboot",
"validate-password",,"ON,OFF,FORCE,FORCE_PLUS_PERMANENT",false,"engine-default","static","string","This option controls how the server loads the validate_password plugin at startup.","pending-reboot",
"validate_password_dictionary_file",,,false,"engine-default","static","string","The path name of the dictionary file used by the validate_password plugin for checking passwords.","pending-reboot",
"validate_password_length",,"0-2147483647",false,"engine-default","dynamic","integer","The path name of the dictionary file used by the validate_password plugin for checking passwords.","pending-reboot",
"validate_password_mixed_case_count",,"0-2147483647",false,"engine-default","dynamic","integer","The minimum number of lowercase and uppercase characters that passwords checked by the validate_password plugin must have if the password policy is MEDIUM or stronger.","pending-reboot",
"validate_password_number_count",,"0-2147483647",false,"engine-default","dynamic","integer","The minimum number of numeric (digit) characters that passwords checked by the validate_password plugin must have if the password policy is MEDIUM or stronger.","pending-reboot",
"validate_password_policy",,"LOW,MEDIUM,STRONG",false,"engine-default","dynamic","string","The password policy enforced by the validate_password plugin.","pending-reboot",
"validate_password_special_char_count",,"0-2147483647",false,"engine-default","dynamic","integer","The minimum number of nonalphanumeric characters that passwords checked by the validate_password plugin must have if the password policy is MEDIUM or stronger.","pending-reboot",
"wait_timeout",,"1-31536000",true,"engine-default","dynamic","integer","The number of seconds the server waits for activity on a non-interactive TCP/IP or UNIX File connection before closing it.","pending-reboot",