"名前","値","許可された値","変更可能","送信元","適用タイプ","データ型","説明","ApplyMethod","MinimumEngineVersion"
"innodb_buffer_pool_dump_now",,"0,1",false,"engine-default","dynamic","boolean","Immediately records the pages cached in the InnoDB buffer pool.","pending-reboot",
"innodb_buffer_pool_filename",,,false,"engine-default","dynamic","string","Specifies the file that holds the list of page numbers produced by innodb_buffer_pool_dump_at_shutdown or innodb_buffer_pool_dump_now.","pending-reboot",
"innodb_buffer_pool_load_abort",,"0,1",false,"engine-default","dynamic","boolean","Interrupts the process of restoring InnoDB buffer pool contents triggered by innodb_buffer_pool_load_at_startup or innodb_buffer_pool_load_now.","pending-reboot",
"innodb_buffer_pool_load_at_startup","0","0,1",false,"engine-default","static","boolean","Specifies that, on MySQL server startup, the InnoDB buffer pool is automatically warmed up by loading the same pages it held at an earlier time.","pending-reboot",
"innodb_buffer_pool_load_now",,"0,1",false,"engine-default","dynamic","boolean","Immediately warms up the InnoDB buffer pool by loading a set of data pages, without waiting for a server restart. ","pending-reboot",
"innodb_buffer_pool_size","{DBInstanceClassMemory*3/4}","335544320-9223372036854775807",true,"system","static","integer","The size in bytes of the memory buffer innodb uses to cache data and indexes of its tables","pending-reboot",
"innodb_change_buffer_max_size",,"0-50",false,"engine-default","dynamic","integer","Maximum size for the InnoDB change buffer, as a percentage of the total size of the buffer pool.","pending-reboot",
"innodb_checksum_algorithm","none","crc32,innodb,none,strict_crc32,strict_innodb,strict_none",false,"system","dynamic","string","Specifies how to generate and verify the checksum stored in each disk block of each InnoDB tablespace.","pending-reboot",
"innodb_commit_concurrency",,"0-1000",true,"engine-default","static","integer","The number of threads that can commit at the same time.","pending-reboot",
"innodb_concurrency_tickets",,"1-4294967295",true,"engine-default","dynamic","integer","Number of times a thread can enter and leave Innodb before it is subject to innodb-thread-concurrency","pending-reboot",
"innodb_data_home_dir",,,false,"system","static","string","Directory where innodb files are stored","pending-reboot",
"innodb_deadlock_detect",,"0,1",true,"engine-default","dynamic","boolean","This option is used to disable deadlock detection. On high concurrency systems, deadlock detection can cause a slowdown when numerous threads wait for the same lock. Please consult the MySQL Documentation for more infotmation on this parameter.","pending-reboot",
"innodb_default_row_format",,"DYNAMIC,COMPACT,REDUNDANT",true,"engine-default","dynamic","string","Defines the default row format for InnoDB tables (including user-created InnoDB temporary tables).","pending-reboot",
"innodb_doublewrite","0","0",false,"system","static","boolean","InnoDB doublewrite must be disabled in Oscar","pending-reboot",
"innodb_file_per_table",,"0,1",true,"engine-default","static","boolean","Use tablespaces or files for Innodb.","pending-reboot",
"innodb_fill_factor",,"10-100",true,"engine-default","dynamic","integer","Defines the percentage of space on each B-tree page that is filled during a sorted index build, with the remaining space reserved for future index growth.","pending-reboot",
"innodb_flushing_avg_loops",,"1-1000",false,"engine-default","dynamic","integer","Number of iterations for which InnoDB keeps the previously calculated snapshot of the flushing state, controlling how quickly adaptive flushing responds to changing workloads.","pending-reboot",
"innodb_flush_log_at_timeout",,"0-2700",false,"engine-default","dynamic","integer","Write and flush the logs every N seconds. This setting has an effect only when innodb_flush_log_at_trx_commit has a value of 2.","pending-reboot",
"innodb_flush_log_at_trx_commit",,"0-2",false,"engine-default","dynamic","integer","Determines Innodb transaction durability","pending-reboot",
"innodb_flush_method","O_DIRECT","O_DIRECT",false,"system","static","string","Determines Innodb flush method","pending-reboot",
"innodb_flush_neighbors",,"0-2",false,"engine-default","dynamic","integer","Specifies whether flushing a page from the InnoDB buffer pool also flushes other dirty pages in the same extent.","pending-reboot",
"innodb_force_load_corrupted",,"0,1",false,"engine-default","static","boolean","Lets InnoDB load tables at startup that are marked as corrupted","pending-reboot",
"innodb_ft_aux_table",,,true,"engine-default","dynamic","string","Specifies the qualified name of an InnoDB table containing a FULLTEXT index.","pending-reboot",
"innodb_ft_cache_size",,"0-4294967295",true,"engine-default","static","integer","Size of the cache that holds a parsed document in memory while creating an InnoDB FULLTEXT index.","pending-reboot",
"innodb_ft_enable_stopword",,"0,1",true,"engine-default","dynamic","boolean","Specifies that a set of stopwords is associated with an InnoDB FULLTEXT index at the time the index is created.","pending-reboot",
"innodb_ft_max_token_size",,"10-252",true,"engine-default","static","integer","Maximum length of words that are stored in an InnoDB FULLTEXT index.","pending-reboot",
"innodb_ft_min_token_size",,"0-16",true,"engine-default","static","integer","Minimum length of words that are stored in an InnoDB FULLTEXT index.","pending-reboot",
"innodb_ft_num_word_optimize",,"1-4294967295",true,"engine-default","dynamic","integer","Number of words to process during each OPTIMIZE TABLE operation on an InnoDB FULLTEXT index.","pending-reboot",
"innodb_ft_server_stopword_table",,,true,"engine-default","dynamic","string","Name of the table containing a list of words to ignore when creating an InnoDB FULLTEXT index, in the format db_name/table_name.","pending-reboot",
"innodb_ft_sort_pll_degree",,"1-32",true,"engine-default","static","integer","Number of threads used in parallel to index and tokenize text in an InnoDB FULLTEXT index, when building a search index for a large table.","pending-reboot",
"innodb_ft_user_stopword_table",,,true,"engine-default","dynamic","string","Name of the table containing a list of words to ignore when creating an InnoDB FULLTEXT index, in the format db_name/table_name.","pending-reboot",
"innodb_io_capacity",,"100-18446744073709551615",false,"engine-default","dynamic","integer","The maximum number of I/O operations per second that InnoDB will perform.","pending-reboot",
"innodb_io_capacity_max",,"2000-18446744073709547520",false,"engine-default","dynamic","integer","The limit up to which InnoDB is allowed to extend the innodb_io_capacity setting in case of emergency.","pending-reboot",
"innodb_lock_wait_timeout",,"1-1073741824",true,"engine-default","dynamic","integer","Timeout in seconds an innodb transaction may wait for a row lock before giving up","pending-reboot",
"innodb_log_compressed_pages",,"0,1",false,"engine-default","dynamic","boolean","Specifies whether images of re-compressed pages are stored in InnoDB redo logs. ","pending-reboot",
"innodb_lru_scan_depth",,"100-18446744073709551615",true,"engine-default","dynamic","integer","A parameter that influences the algorithms and heuristics for the flush operation for the InnoDB buffer pool.","pending-reboot",
"innodb_max_dirty_pages_pct",,"0-99",true,"engine-default","dynamic","integer","Maximum percentage of dirty pages in the buffer pool","pending-reboot",
"innodb_max_purge_lag",,"0-4294967295",true,"engine-default","dynamic","integer","Controls how to delay INSERT, UPDATE, and DELETE operations when purge operations are lagging","pending-reboot",
"innodb_max_purge_lag_delay",,"0-18446744073709551615",true,"engine-default","dynamic","integer","Specifies the maximum delay in microseconds for the delay imposed by the innodb_max_purge_lag configuration option","pending-reboot",
"innodb_monitor_disable",,,true,"engine-default","dynamic","string","Turns off one or more counters in the information_schema.innodb_metrics table.","pending-reboot",
"innodb_monitor_enable",,,true,"engine-default","dynamic","string","Turns on one or more counters in the information_schema.innodb_metrics table.","pending-reboot",
"innodb_monitor_reset",,,true,"engine-default","dynamic","string","Resets to zero the count value for one or more counters in the information_schema.innodb_metrics table.","pending-reboot",
"innodb_monitor_reset_all",,,true,"engine-default","dynamic","string","Resets all values (minimum, maximum, and so on) for one or more counters in the information_schema.innodb_metrics table.","pending-reboot",
"innodb_old_blocks_pct",,"5-95",true,"engine-default","dynamic","integer","Specifies the approximate percentage of the InnoDB buffer pool used for the old block sublist.","pending-reboot",
"innodb_old_blocks_time",,"0-4294967295",true,"engine-default","dynamic","integer","Specifies how long in milliseconds (ms) a block inserted into the old sublist must stay there after its first access before it can be moved to the new sublist.","pending-reboot",
"innodb_online_alter_log_max_size",,"65536-18446744073709551615",true,"engine-default","dynamic","integer","Specifies an upper limit on the size of the temporary log files used during online DDL operations for InnoDB tables.","pending-reboot",
"innodb_open_files",,"-1,10-4294967295",true,"engine-default","static","integer","Relevant only if you use multiple tablespaces in innodb. It specifies the maximum number of .ibd files that innodb can keep open at one time","pending-reboot",
"innodb_optimize_fulltext_only",,"0,1",true,"engine-default","dynamic","boolean","Changes the way the OPTIMIZE TABLE statement operates on InnoDB tables.","pending-reboot",
"innodb_page_cleaners",,"1-64",true,"engine-default","static","integer","The number of page cleaner threads that flush dirty pages from buffer pool instances.","pending-reboot",
"innodb_page_size",,,false,"engine-default","static","string","Specifies the page size for all InnoDB tablespaces in a MySQL instance.","pending-reboot",
"innodb_print_all_deadlocks",,"0,1",true,"engine-default","dynamic","boolean","Records information about all InnoDB deadlocks in Aurora error log.","pending-reboot",
"innodb_purge_batch_size",,"1-5000",true,"engine-default","dynamic","integer","The granularity of changes, expressed in units of redo log records, that trigger a purge operation, flushing the changed buffer pool blocks to disk","pending-reboot",
"innodb_purge_threads",,"0-1",true,"engine-default","static","integer","The number of background threads devoted to the InnoDB purge operation","pending-reboot",
"innodb_read_io_threads",,"1-64",false,"engine-default","static","integer","The number of I/O threads for read operations in InnoDB.","pending-reboot",
"innodb_read_only",,"0,1",false,"engine-default","static","boolean","Starts the server in read-only mode.","pending-reboot",
"innodb_replication_delay",,"0-4294967295",true,"engine-default","dynamic","integer","The replication thread delay (in ms) on a replica server if innodb_thread_concurrency is reached.","pending-reboot",
"innodb_rollback_on_timeout",,"0,1",true,"engine-default","static","boolean","Controls whether timeouts rollback the last statement or the entire transaction","pending-reboot",
"innodb_rollback_segments",,"1-128",true,"engine-default","dynamic","integer","Defines how many of the rollback segments in the system tablespace that InnoDB uses within a transaction.","pending-reboot",
"innodb_sort_buffer_size",,"65536-67108864",true,"engine-default","static","integer","Specifies the sizes of several buffers used for sorting data during creation of an InnoDB index.","pending-reboot",
"innodb_spin_wait_delay",,"0-4294967295",true,"engine-default","dynamic","integer","The maximum delay between polls for a spin lock.","pending-reboot",
"innodb_spin_wait_pause_multiplier",,"1-100",true,"engine-default","dynamic","integer","Defines a multiplier value used to determine the number of PAUSE instructions in spin-wait loops that occur when a thread waits to acquire a mutex or rw-lock.","pending-reboot",
"innodb_stats_auto_recalc",,"0,1",true,"system","dynamic","boolean","Causes InnoDB to automatically recalculate persistent statistics after the data in a table is changed substantially.","pending-reboot",
"innodb_stats_include_delete_marked",,"0,1",true,"engine-default","static","boolean","When innodb_stats_include_delete_marked is enabled, ANALYZE TABLE considers delete-marked records when recalculating statistics.","pending-reboot",
"innodb_stats_method",,"nulls_equal,nulls_unequal,nulls_ignored",true,"engine-default","dynamic","string","How the server treats NULL values when collecting statistics about the distribution of index values for InnoDB tables.","pending-reboot",
"innodb_stats_on_metadata",,"0,1",true,"engine-default","dynamic","boolean","Controls whether table and index stats are updated when getting status information via SHOW STATUS or the INFORMATION_SCHEMA","pending-reboot",
"innodb_stats_persistent",,"OFF,ON,0,1",true,"system","dynamic","boolean","Specifies whether the InnoDB index statistics produced by the ANALYZE TABLE command are stored on disk.","pending-reboot",
"innodb_stats_persistent_sample_pages",,"0-18446744073709551615",true,"engine-default","dynamic","integer","The number of index pages to sample when estimating cardinality and other statistics for an indexed column, such as those calculated by ANALYZE TABLE.","pending-reboot",
"innodb_stats_transient_sample_pages",,"0-18446744073709551615",true,"engine-default","dynamic","integer","The number of index pages to sample when estimating cardinality and other statistics for an indexed column, such as those calculated by ANALYZE TABLE.","pending-reboot",
"innodb_status_output",,"0,1",true,"engine-default","dynamic","boolean","Enables or disables periodic output for the standard InnoDB Monitor.","pending-reboot",
"innodb_status_output_locks",,"0,1",true,"engine-default","dynamic","boolean","Enables or disables the InnoDB Lock Monitor.","pending-reboot",
"innodb_strict_mode",,"0,1",true,"engine-default","dynamic","boolean","Whether InnoDB returns errors rather than warnings for exceptional conditions.","pending-reboot",
"innodb_sync_array_size",,"1-1024",true,"engine-default","static","integer","Splits an internal data structure used to coordinate threads, for higher concurrency in workloads with large numbers of waiting threads.","pending-reboot",
"innodb_sync_spin_loops","30","0-9223372036854775807",true,"engine-default","dynamic","integer","The number of times a thread waits for an innodb mutex to be freed before the thread is suspended","pending-reboot",
"innodb_table_locks",,"0,1",true,"engine-default","dynamic","boolean","If autocommit = 0, innodb honors LOCK TABLES","pending-reboot",
"innodb_thread_concurrency",,"0-1000",false,"engine-default","dynamic","integer","The number of threads that can enter innodb concurrently","pending-reboot",
"innodb_thread_sleep_delay",,"0-9223372036854775807",true,"engine-default","dynamic","integer","How long innodb threads sleep before joining the innodb queue, in microseconds.","pending-reboot",
"innodb_undo_directory",,,false,"system","static","string","The relative or absolute directory path where InnoDB creates separate tablespaces for the undo logs","pending-reboot",
"innodb_use_native_aio",,"0,1",false,"engine-default","static","boolean","Controls whether or not MySQL uses Linux native asynchronous IO.","pending-reboot",
"innodb_write_io_threads",,"1-64",false,"engine-default","static","integer","The number of I/O threads for write operations in InnoDB.","pending-reboot",
"interactive_timeout",,"1-31536000",true,"engine-default","dynamic","integer","Number of seconds the server waits for activity on an interactive connection before closing it.","pending-reboot",
"internal_tmp_mem_storage_engine","TempTable","TempTable,MEMORY",true,"system","dynamic","string","Controls which in-memory storage engine is used for internal temporary tables","pending-reboot",
"join_buffer_size",,"128-18446744073709547520",true,"engine-default","dynamic","integer","Increase the value of join_buffer_size to get a faster full join when adding indexes is not possible.","pending-reboot",
"keep_files_on_create",,"0,1",true,"engine-default","dynamic","boolean","Suppress behavior to overwrite MyISAM file created in DATA DIRECTORY or INDEX DIRECTORY.","pending-reboot",
"key_buffer_size","16777216","4096-4294967295",true,"system","dynamic","integer","Increase the buffer size to get better index handling used for index blocks (for all reads and multiple writes).","pending-reboot",
"key_cache_age_threshold",,"100-18446744073709547520",true,"engine-default","dynamic","integer","Controls the demotion of buffers from the hot sub-chain of a key cache to the warm sub-chain. Lower values cause demotion to happen more quickly.","pending-reboot",
"key_cache_block_size",,"512-16384",true,"engine-default","dynamic","integer","Size in bytes of blocks in the key cache.","pending-reboot",
"key_cache_division_limit",,"1-100",true,"engine-default","dynamic","integer","The division point between the hot and warm sub-chains of the key cache buffer chain. The value is the percentage of the buffer chain to use for the warm sub-chain.","pending-reboot",
"lc_time_names",,"ar_AE,ar_BH,ar_DZ,ar_EG,ar_IN,ar_IQ,ar_JO,ar_KW,ar_LB,ar_LY,ar_MA,ar_OM,ar_QA,ar_SA,ar_SD,ar_SY,ar_TN,ar_YE,be_BY,bg_BG,ca_ES,cs_CZ,da_DK,de_AT,de_BE,de_CH,de_DE,de_LU,el_GR,en_AU,en_CA,en_GB,en_IN,en_NZ,en_PH,en_US,en_ZA,en_ZW,es_AR,es_BO,es_CL,es_CO,es_CR,es_DO,es_EC,es_ES,es_GT,es_HN,es_MX,es_NI,es_PA,es_PE,es_PR,es_PY,es_SV,es_US,es_UY,es_VE,et_EE,eu_ES,fi_FI,fo_FO,fr_BE,fr_CA,fr_CH,fr_FR,fr_LU,gl_ES,gu_IN,he_IL,hi_IN,hr_HR,hu_HU,id_ID,is_IS,it_CH,it_IT,ja_JP,ko_KR,lt_LT,lv_LV,mk_MK,mn_MN,ms_MY,nb_NO,nl_BE,nl_NL,no_NO,pl_PL,pt_BR,pt_PT,ro_RO,ru_RU,ru_UA,sk_SK,sl_SI,sq_AL,sr_RS,sv_FI,sv_SE,ta_IN,te_IN,th_TH,tr_TR,uk_UA,ur_PK,vi_VN,zh_CN,zh_HK,zh_TW",true,"engine-default","dynamic","string","This variable specifies the locale that controls the language used to display day and month names and abbreviations.","pending-reboot",
"local_infile","1","0,1",true,"system","dynamic","boolean","Controls whetther LOCAL is supported for LOAD DATA INFILE","pending-reboot",
"lock_wait_timeout",,"1-31536000",true,"engine-default","dynamic","integer","Specifies the timeout in seconds for attempts to acquire metadata locks","pending-reboot",
"log-bin","/rdsdbdata/log/binlog/mysql-bin-changelog",,false,"system","static","string","Controls binary logging.","pending-reboot",
"log_bin_trust_function_creators",,"0,1",true,"engine-default","dynamic","boolean","Enforces restrictions on stored functions / triggers - logging for replication.","pending-reboot",
"log_error","/rdsdbdata/log/error/mysql-error.log",,false,"system","static","string","Location  of error log.","pending-reboot",
"log_error_verbosity",,"1-3",true,"engine-default","dynamic","integer","Controls verbosity of the server in writing error, warning, and note messages to the error log.","pending-reboot",
"log_output","FILE","TABLE,FILE,NONE",true,"system","dynamic","string","Controls where to store query logs","pending-reboot",
"log_queries_not_using_indexes",,"0,1",true,"engine-default","dynamic","boolean","Logs queries that are expected to retrieve all rows to slow query log","pending-reboot",
"log_replica_updates","1","0,1",false,"system","static","boolean","log_replica_updates specifies whether updates received by a replica server from a replication source server should be logged to the replica's own binary log.","pending-reboot",
"log_slow_admin_statements",,"0,1",true,"engine-default","dynamic","boolean","Include slow administrative statements in the statements written to the slow query log.","pending-reboot",
"log_slow_extra",,"0,1",true,"engine-default","dynamic","boolean","When the slow query log is enabled and the output destination as FILE, additional information related to the slow query is written to the slow query log file. TABLE output is unaffected","pending-reboot",
"log_slow_replica_statements",,"0,1",true,"engine-default","dynamic","boolean","When the slow query log is enabled, this variable enables logging for queries that have taken more than long_query_time seconds to execute on the replica.","pending-reboot",
"log_throttle_queries_not_using_indexes",,"0-4294967295",true,"engine-default","dynamic","integer","Limits the number of such queries per minute that can be written to the slow query log.","pending-reboot",
"long_query_time",,"0-31536000",true,"engine-default","dynamic","float","Defines what MySQL considers long queries","pending-reboot",
"lower_case_table_names",,"0-1",true,"engine-default","static","integer","Affects how the server handles identifier case sensitivity","pending-reboot",
"low_priority_updates",,"0,1",true,"engine-default","dynamic","boolean","INSERT, UPDATE, DELETE, and LOCK TABLE WRITE wait until no pending SELECT. Affects only storage engines that use only table-level locking (MyISAM, MEMORY, MERGE).","pending-reboot",
"mandatory_roles",,,true,"engine-default","dynamic","string","Roles the server should treat as mandatory. In effect, these roles are automatically granted to every user, although setting mandatory_roles does not actually change any user accounts. Please consult MySQL documentation for more infomation on usage.","pending-reboot",
"max_allowed_packet",,"1024-1073741824",true,"engine-default","dynamic","integer","This value by default is small, to catch large (possibly incorrect) packets. Must be increased if using large BLOB columns or long strings. As big as largest BLOB. ","pending-reboot",
"max_binlog_cache_size",,"4096-18446744073709547520",true,"engine-default","dynamic","integer","Maximum binlog cache size a transaction may use","pending-reboot",
"max_binlog_size","134217728","4096-1073741824",false,"system","dynamic","integer","Server rotates the binlog once it reaches this size","pending-reboot",
"max_binlog_stmt_cache_size",,"4096-18446744073709547520",true,"engine-default","dynamic","integer","If nontransactional statements within a transaction require more than this many bytes of memory, the server generates an error.","pending-reboot",
"max_connect_errors",,"1-18446744073709547520",true,"engine-default","dynamic","integer","A host is blocked from further connections if there are more than this number of interrupted connections","pending-reboot",
"max_connections","GREATEST({log(DBInstanceClassMemory/805306368)*45},{log(DBInstanceClassMemory/8187281408)*1000})","1-16000",true,"system","dynamic","integer","The number of simultaneous client connections allowed.","pending-reboot",
"max_delayed_threads",,"0-16384",true,"engine-default","dynamic","integer","Do not start more than this number of threads to handle INSERT DELAYED statements.","pending-reboot",
"max_error_count",,"0-65535",true,"engine-default","dynamic","integer","The maximum number of error, warning, and note messages to be stored for display.","pending-reboot",
"max_execution_time",,"0-18446744073709551615",true,"engine-default","dynamic","integer","The execution timeout for SELECT statements, in milliseconds.","pending-reboot",
"max_heap_table_size",,"16384-1844674407370954752",true,"engine-default","dynamic","integer","Maximum size to which MEMORY tables are allowed to grow.","pending-reboot",
"max_insert_delayed_threads",,"0-16384",true,"engine-default","dynamic","integer","Synonym for max_delayed_threads","pending-reboot",
"max_join_size",,"1-18446744073709551615",true,"engine-default","dynamic","integer","Catch SELECT statements where keys are not used properly and would probably take a long time. ","pending-reboot",
"max_points_in_geometry",,"3-1048576",false,"engine-default","dynamic","integer","The maximum value of the points_per_circle argument to the ST_Buffer_Strategy() function.","pending-reboot",
"max_prepared_stmt_count",,"0-1048576",true,"engine-default","dynamic","integer","Used if the potential for denial-of-service attacks based on running the server out of memory by preparing huge numbers of statements.","pending-reboot",
"max_seeks_for_key",,"1-18446744073709547520",true,"engine-default","dynamic","integer","A low value can force MySQL to prefer indexes instead of table scans.","pending-reboot",
"max_sort_length",,"4-8388608",true,"engine-default","dynamic","integer","The number of bytes to use when sorting BLOB or TEXT values.","pending-reboot",
"max_sp_recursion_depth",,"0-255",true,"engine-default","dynamic","integer","Limits the number of times a stored procedure can be called recursively minimizing the demand on thread stack space.","pending-reboot",
"max_user_connections",,"0-4294967295",true,"engine-default","dynamic","integer","Maximum number of simultaneous connections allowed to any given MySQL account. ","pending-reboot",
"max_write_lock_count",,"1-18446744073709547520",true,"engine-default","dynamic","integer","After this many write locks, allow some pending read lock requests to be processed in between.","pending-reboot",
"min_examined_row_limit",,"0-18446744073709547520",true,"engine-default","dynamic","integer","Can be used to cause queries which examine fewer than the stated number of rows not to be logged.","pending-reboot",
"myisam_data_pointer_size",,"2-7",true,"engine-default","dynamic","integer","The default pointer size in bytes, to be used by CREATE TABLE for MyISAM tables when no MAX_ROWS option is specified.","pending-reboot",
"myisam_max_sort_file_size",,"0-9223372036853727232",true,"engine-default","dynamic","integer","The maximum size of the temporary file that MySQL is allowed to use while re-creating a MyISAM index","pending-reboot",
